{
  "$schema": "https://json-schema.org/draft/2020-12/schema",
  "$id": "https://github.com/Conxian/Conxian/blob/main/deployment/deployment-evidence.schema.json",
  "title": "Conxian deployment evidence bundle",
  "description": "Evidence for checked deployment addresses. A plan, workflow result, or broadcast is not canonical deployment proof.",
  "type": "object",
  "additionalProperties": false,
  "required": [
    "schemaVersion",
    "evidenceStatus",
    "generatedAt",
    "sourceCommit",
    "network",
    "deployer",
    "plan",
    "claims",
    "contractPublications",
    "contractCalls",
    "interfaces"
  ],
  "properties": {
    "schemaVersion": {
      "const": "1"
    },
    "evidenceStatus": {
      "enum": ["plan", "workflow", "broadcast", "confirmed"]
    },
    "generatedAt": {
      "type": "string",
      "format": "date-time"
    },
    "verifiedAt": {
      "type": "string",
      "format": "date-time"
    },
    "sourceCommit": {
      "type": "string",
      "pattern": "^[0-9a-f]{40}$"
    },
    "network": {
      "enum": ["testnet", "mainnet"]
    },
    "deployer": {
      "$ref": "#/$defs/address"
    },
    "plan": {
      "type": "object",
      "additionalProperties": false,
      "required": ["path", "sha256"],
      "properties": {
        "path": {
          "type": "string",
          "minLength": 1
        },
        "sha256": {
          "type": "string",
          "pattern": "^[0-9a-f]{64}$"
        }
      }
    },
    "claims": {
      "type": "object",
      "additionalProperties": false,
      "required": ["scope", "globalNonexistence"],
      "properties": {
        "scope": {
          "const": "checked-addresses"
        },
        "globalNonexistence": {
          "const": false
        }
      }
    },
    "contractPublications": {
      "type": "array",
      "minItems": 1,
      "items": {
        "$ref": "#/$defs/contractPublication"
      }
    },
    "contractCalls": {
      "type": "array",
      "items": {
        "$ref": "#/$defs/contractCall"
      }
    },
    "interfaces": {
      "type": "array",
      "minItems": 1,
      "items": {
        "$ref": "#/$defs/interfaceExpectation"
      }
    },
    "preexistingContracts": {
      "type": "array",
      "uniqueItems": true,
      "items": {
        "$ref": "#/$defs/contractId"
      }
    }
  },
  "$defs": {
    "address": {
      "type": "string",
      "pattern": "^S[PT][0-9A-Z]{39}$"
    },
    "contractName": {
      "type": "string",
      "pattern": "^[a-zA-Z][a-zA-Z0-9-]{0,39}$"
    },
    "contractId": {
      "type": "string",
      "pattern": "^S[PT][0-9A-Z]{39}\\.[a-zA-Z][a-zA-Z0-9-]{0,39}$"
    },
    "txid": {
      "type": "string",
      "pattern": "^0x[0-9a-fA-F]{64}$"
    },
    "requiredFunction": {
      "type": "object",
      "additionalProperties": false,
      "required": ["name", "access"],
      "properties": {
        "name": {
          "$ref": "#/$defs/contractName"
        },
        "access": {
          "enum": ["public", "read_only"]
        }
      }
    },
    "transactionApiEvidence": {
      "type": "object",
      "additionalProperties": false,
      "required": [
        "observedAt",
        "endpoint",
        "txId",
        "txStatus",
        "canonical",
        "isUnanchored",
        "txType",
        "senderAddress",
        "contractId",
        "functionName",
        "blockHash",
        "blockHeight",
        "burnBlockHash",
        "burnBlockHeight"
      ],
      "properties": {
        "observedAt": {
          "type": "string",
          "format": "date-time"
        },
        "endpoint": {
          "type": "string",
          "format": "uri"
        },
        "txId": {
          "$ref": "#/$defs/txid"
        },
        "txStatus": {
          "const": "success"
        },
        "canonical": {
          "const": true
        },
        "isUnanchored": {
          "const": false
        },
        "txType": {
          "enum": ["smart_contract", "contract_call"]
        },
        "senderAddress": {
          "$ref": "#/$defs/address"
        },
        "contractId": {
          "$ref": "#/$defs/contractId"
        },
        "functionName": {
          "type": ["string", "null"]
        },
        "blockHash": {
          "type": "string",
          "minLength": 1
        },
        "blockHeight": {
          "type": "integer",
          "minimum": 1
        },
        "burnBlockHash": {
          "type": "string",
          "minLength": 1
        },
        "burnBlockHeight": {
          "type": "integer",
          "minimum": 1
        },
        "blockTimeIso": {
          "type": "string",
          "format": "date-time"
        },
        "burnBlockTimeIso": {
          "type": "string",
          "format": "date-time"
        }
      }
    },
    "interfaceApiEvidence": {
      "type": "object",
      "additionalProperties": false,
      "required": ["observedAt", "endpoint", "httpStatus", "functions"],
      "properties": {
        "observedAt": {
          "type": "string",
          "format": "date-time"
        },
        "endpoint": {
          "type": "string",
          "format": "uri"
        },
        "httpStatus": {
          "const": 200
        },
        "functions": {
          "type": "array",
          "items": {
            "$ref": "#/$defs/requiredFunction"
          }
        }
      }
    },
    "contractPublication": {
      "type": "object",
      "additionalProperties": false,
      "required": ["kind", "contractName", "contractId", "expectedSender", "txid"],
      "properties": {
        "kind": {
          "const": "contract-publish"
        },
        "contractName": {
          "$ref": "#/$defs/contractName"
        },
        "contractId": {
          "$ref": "#/$defs/contractId"
        },
        "expectedSender": {
          "$ref": "#/$defs/address"
        },
        "txid": {
          "$ref": "#/$defs/txid"
        },
        "apiEvidence": {
          "$ref": "#/$defs/transactionApiEvidence"
        }
      }
    },
    "contractCall": {
      "type": "object",
      "additionalProperties": false,
      "required": ["kind", "contractId", "functionName", "expectedSender", "txid"],
      "properties": {
        "kind": {
          "const": "contract-call"
        },
        "contractId": {
          "$ref": "#/$defs/contractId"
        },
        "functionName": {
          "$ref": "#/$defs/contractName"
        },
        "expectedSender": {
          "$ref": "#/$defs/address"
        },
        "txid": {
          "$ref": "#/$defs/txid"
        },
        "apiEvidence": {
          "$ref": "#/$defs/transactionApiEvidence"
        }
      }
    },
    "interfaceExpectation": {
      "type": "object",
      "additionalProperties": false,
      "required": ["contractId", "requiredFunctions"],
      "properties": {
        "contractId": {
          "$ref": "#/$defs/contractId"
        },
        "requiredFunctions": {
          "type": "array",
          "items": {
            "$ref": "#/$defs/requiredFunction"
          }
        },
        "interfaceEvidence": {
          "$ref": "#/$defs/interfaceApiEvidence"
        }
      }
    }
  }
}
